{"trace_id":"trace-synthetic-1","run_id":"run-synthetic-1","session_key_hash":"sha256:1111111111111111111111111111111111111111111111111111111111111111","sync_generation":"generation-1","knowledge_snapshot":"authority-revision-1","state_view_version":"view-1","validated_router_result":null,"cognitive_bindings":[{"id":"cog-synthetic-governing","role":"governing_system","version":"1","status":"injected"}],"stable_refs":[{"id":"sem-synthetic-preference","status":"retrieved"}],"unresolved_conflicts":[],"trace_status":"complete","eval_eligible":true,"created_at":"2026-08-11T00:00:04Z"}
